id,type,text1,text2,text3,notes
Argriv_I,CUSTOM,"战时与速子科技联手管理的挥发物提取地，也是与速子科技进行科技交流的一个重要地点，然而在期间的一次突袭中遭到了毁灭性的轨道轰炸打击，迫使综合体当局放弃了这块变得混乱的地方。

如今这里已成为速子科技的一个偏远的前哨，但有传言称，在星球上的一些不为人知的角落里，仍藏着综合体的精锐机动部队监视着这里的一举一动。",,,
MagneStation,CUSTOM,综合体与速子科技一起建造的巨型轨道钻机，奇怪的是这个轨道钻机实际上并不属于任何一方，也不属于星区内任何一个活跃的势力。,,,
horizonVortexRingworldicon,CUSTOM,"工程学上的一大奇迹，恒星环，一种拥有前所未有的庞大体积的，可以拥有几乎无数种功能的环形可居住结构，朝着恒星的一面被用高强度半透明结构与外太空隔绝的土地，河流，植被所铺满，一系列高度自动化的设备时刻调节着这个巨大空间内的气候，其他部分被一块又一块巨大的强化外装甲板与主动防御装置占满，而内部则可能井然有序地排列着各种超大型工业机械。

而这种仅仅是建造一小段就能掏空一个庞大势力的资源储备的巨大结构，不管从任何地方来看都明显不可能出自人之领之手，但也无人得知结构创造者的任何一丝信息，但明确知道的是，厄雷修斯技术综合体绝对是这一切之中的最大获利者。",,,
,,,,,